"It looked great nice decor, food was delicious"
"Since I moved to this part of Bushwick I’m a regular customer at Tony’s. They deliver pizza always on time an it’s always fresh. Tried a wide variety of dishes from the menu and they always outdo themselves. Great place, the tradition itself says it all. I love Tony’s Pizza!"
Always a great place to relax and enjoy your soup with a good Pasta.
The worst foods in my life!!  Finger sized sushi. Dried out foods.  I feel like I’ve paid quite a money for some left over foods stayed in a refrigerator for weeks that should’ve thrown into a trash can.  They offer a free cocktail for a good review on google or yelp.  I shouldn’t trust the reviews and photos.
The best
"I was expecting more. The design is amazing, the dj was ok. The food was standard for these kinds of places nothing exciting, the ceviche over dressed, not subtle at all. The sushi and scallops were very good. But most of all the service was just odd - drinks took forever and a lot of staff had a ""not my job"" response for requests or questions. I'll give them another try in a few months when they've settled in. For now, it feels like there's room for improvement."
"Nice location, server was doing her best, however the kitchen took over an hour to get our appetizers in, not even mentioning entrees.  Food is good, when it finally arrives.  Very young crowd gathers on Fri evening, barely out of their teens."
"Absolutely, you have to go there if you like trying new types of food. The food is so delicious.  Especially, the Henithe, it is amazing."
"They have free valet parking. The food is good, especially the lobster ravioli and the lasagna. It's like 13 dollars for a cocktail and around 10 bucks for a glass of wine. The waitress was very nice. I would come back again."
Good food always ordered late night
"We enjoyed the food and the service.  Just one thing marred our visit.  I called the restaurant before leaving the house to ask if it was a BYOB and was told, yes, you can bring your own bottle. So we were unpleasantly surprised to find a corkage fee of $10.00 on our bill. When I questioned the waitress, she responded that they always charge this fee. When I told her about my call to the restaurant, she lowered it to $5.00; still left a bad taste."
This was the worst experience. I asked for a steak medium and got a hard piece of rock. When i mentiomed it to the waiter Lopez he rolled his eyes and said thats what the chef gave me. i asked for a Manager and was told the Manager went home. Never again. i wish I could give them 0 stars.
Aloo chole curry had no taste what so ever. Puris were filled with a lot of extra oil. On top of it they charged twice as much as item was listed in menu.
Wonderful place with excellent food! The vibe in here is relaxing with great staff. We decided to sit at the bar and we are glad we did because the bartender there was excellent. Drinks were on point and the food was even better. My wife had the penne and I had the gnocchi. Price was fair for 2 people. Will definitely be coming back here again. Well run establishment. Good job guys!
The lines are long but the food is excellent! Definitely worth the wait.
They have some of the best Peruvian food and are quite filling.
The best (authentic) and most professional Turkish restaurant in New Jersey.
Taiwanese food
The service is very rude
Impeccable service and the food is amazing. Everyone need to go here for authentic Italian cuisine
Their bar sucks  Water DOWN ther drinks
Great service! Mehlika was the best server! Very recommended. Great environment. Mo is the best :)
"Our server Anne was great. Aqueel is the manager and he does a great job. Very sociable and attentive to his customers.  Customer service and food was great. The place accommodated every need no matter how ridiculous the request. For a relaxing and exciting experience, definitely give Imperial 46 a try!  Great food and prices. Highly recommended."
"It’s decently priced for the all the food you get, plus or minus a few dishes you would traditionally get within a set. Can’t complain about the service."
"I was shockingly surprised to find such a proper Italian restaurant next to Central Park.  The atmosphere was very nice, the food was on point and the wine too.  I would recommend it to anyone who wants to enjoy the traditional Italian cuisine.    Bravi!"
Food is Great ....service outstanding every time.
Good service and great food. Malaysian dishes were authentic.
This place is good but a rip off.  The menu prices posted online are out of date.  A sausage and mushroom pie should not cost $25.  Food is good but too expensive.  It’s just pizza
"Amazing place, best known for its steamed chicken dimsums. All of their dishes are must try. One of best Nepalese restaurant in Jackson heights"
Very friendly service. Not able to understand English well. I thought I was getting sesame shrimp but got sesame chicken because they didn't have shrimp. Wish I would have known. It was good.
"It depends on who you get as a waiter/ waitress most of the time the staff is terrible. Today I was taking a survey on my experience and my waitress literally snatched the survey machine out of my hand and answered the questions herself. I had a bad experience and she literally took it out my hand and said I had a good experience! Beyond rude. Dear Mr. CEO of Olive Garden please run your cameras on may 26, 2017 at around 8 pm at the Elmhurst location to witness how your employee snatched the survey machine out of my hand!!!!!!!!! I WOULD NOT RECOMMEND THIS LOCATION!!!!!!"
Ordered Via Doordash... called the restaurant to try to edit order and the lady acted if she could care less about me ever ordering again... I used to deliver meat to that restaurant and I promise I never seen anyone eating there... so I I know they need my business
"In search of a new Thai resteraunt to try , me & my fam stumbled upon this place. The food here was good. I ordered the drunken rice with shrimp and calamari as an app. The service was slow, we had to wave someone down whenever we needed something because no one ever checked up on us. Nonetheless , the food was good. However I still have yet to find a better Thai resteraunt than rice & noodles in Montclair  .    -Your local Realtor @Safiyasoldit"
The best restaurant you can find in that area the foods are so delicious the service is oh my God super if you live in New York you need to definitely visit that restaurant for visitors the best restaurant with the high service and the food.I love it and highly recommend to all other peoples
A1 Thai in Woodside
"WORST SERVICE EVER! We had to ask 4 times to make the food order, there were literally 3 tables and 2 people in the bar. They got all our drinks wrong (mixing up Mojito with Margarita, bringing a glass of wine instead of a bottle). When we left, obviously we didn't tip more than 10% and they shout it. Unbelievable. I highly recommend to the owner to fire the waitresses to save this business."
The service was outstanding. it was     non-stop  the food  was also  no-stop
"This place is great the service and food is off the chain. If you want the best service, ask for waitress Chama"
I just ordered to go and food was good.
Nice place!!! Good food …
Their food are delicious!
"Went on a Monday night, it was fairly empty. Our server was nowhere in sight for most of the night. Not likely to go back."
Great venue to sit outside enjoy the fresh air beautiful scenery awesome music and delicious food
Charging automatic 18% gratuities on a 5 person party is not acceptable
Great food and service. Skirt steak is excellent and so is the steamed fish.
"Service was great, food was not as great as I hoped, probably because I ordered unfamiliar items; the tea was good."
"The wait staff was attentive and did a nice job. This place is good for drinks, but the quality of their food has been going downhill for a long time and is definitely not worth the price they charge."
"Food was amazing. One of the best places I have ever ate. The waiters were awesome and got a chance to meet the chef Brian, awesome cook with a great personality. I will definitely be coming back here for brunch."
"Vegetarian restaurant. Nice interior and ambiance.    Flavorful food, however they're a bit on the greasy side. The fried rice was greasy even when asked to go light on the oil. Pad thai was a little too wet to my liking but there was flavor. The same goes for the roti.    If you don't mind the grease and glistening rice, the food is fine."
only restaurant in the peruvian jungle in new jersey
"The ambience and service were top of the line, but I have been to better tasting olive gardens."
The food was delicious the service was incredible everybody was on their game and not missing to be very friendly atmosphere would go back again
"Bought a Groupon, and I did not realize that I had to spend $100 to use a $50 Groupon. I spent $93 and they would not honor the Groupon. Honestly, poor way to do business.  Meal was mediocre at best. Place was empty.  Not surprised.  Will not return nor recommend. You're foolishness cost you way more than $7."
the BEST spread / sashimi ever in NYC. Even better service. Love this place!!! So fresh and friendly. And affordable!!
"Great portions and awesome  tasting food.  Bring seasoning though. For some eeason they don't use seasoning; salt, pepper, Adobe, etc..."
Friendly staff that made me feel right at home. I got the Cuban sandwich and it was absolutely delicious. So happy I got to start my day here.
The best Korean style Chinese food in nyc
"I hate the way the owner treats his workers in front of people!!! Don’t yell at anyone in front of your customers. Smh! Learn how to treat people with respect. ( it hurts seen him yell at one of the workers, in front of me and ny mates.) disappointed."
Been eating here for about 3 years
I don't like going to places where the staff looks and acts like they don't want to be there. It reflects on the food and overall experience. Food really wasn't that bad at all. Overall rating for food is a 7/10. Staff needs to tighten up.
I want to take all my friends here for the juicy soup dumplings!
I love the place but is really hot and takes forever to serve the food. I ordered food at 9:00pm and the the people who came to the next table their food came super quick and it take SOOOO long to serve the drinks and our food came at 9: 40 but it I is really good.
I've eaten here more than a few times... everything has been delicious. Their specials are out of this world. Atmosphere is casual. Staff is very knowledgeable.
"I give 2 starts because I ordered 3 orders of tacos with everything. My tacos were no onions , cilantro a little of lettuce. The meat taste no flavor. The chorizo’s tacos were so different from others places no onion , cilantro or lettuce. Too pricey for what I got . Not happy."
Foods always good
The staff are friendly and the service is great and the food is awesome
Went for cocktails with friends. Would like to go back to try out their food next time
As alway food outstanding service was great and the always make me feel so at home there. NEWS FLASH they just recently added a new dessert it is toasted almond tiramisu  OMG it is to die for one of the most delicious desserts I have had in a long time a must have after dinner I strongly suggest you try it next time you visit enjoy :)
One of the newest restaurants in the neighborhood that have great food and also great lunch specials
Superb me and my girlfriend enjoyed eating here service is great and the view of the city makes its a great spot for a romantic evening dinner.
Quick and tasty.
Very good French restaurant with many great food options. Everything we had here tasted so good. The decor is also very beautiful and the service is excellent. They really take care of their clients in this restaurant. You have to make a reservation here otherwise is very likely you won’t get a table. During holidays they decorate the restaurant very nicely. We will definitely come here again in the future.
Bad food regular Chinese food high prize
"Really good food and amazing employees, especially Cardi and Malika."
Great atmosphere and service.  I didn't really like the flavor of my dinner though
"The soups, bread and salad are very good. Unfortunately they no longer offer a garlic and olive oil option instead of tomato based sauce. However previously you were able to order it and the kitchen staff would oblige. In this visit my friend did just that  what she got was a combination of tons of garlic with oil. It was really bad. My photo shows it and even our server agreed. We were given free desert which was great but I doubt if my friend will be returning."
The food was great and the sangria was delicious. They sat us down right away and the food was delivered timely.
Place was great and delicious food
"An amazing place! We thoroughly enjoyed our night at Benoit. The food was delicious, cocktails tasty, and our service was wonderful. It was very European in that we were able to take our time to enjoy pre-dinner cocktails, savor each course, and not feel rushed. Will definitely be returning!"
"Glad that I can get solid dim sum in the neighborhood! All the dishes were good, and the atmosphere is very clean and modern."
"Just the same as I remembered when I first visited in 2016! A huge selection of hot buffet with lots of Korean dishes. There’s the buffet option and the takeaway dishes option, where you can buy the different things in a ready to go bento. There’s also soup and cold dishes in the fridge, like kimbap, salad, and drinks.    If I worked nearby I would definitely be here every other day!"
Good food! Margarita pizza is very delicious! Eggplant is amazing! Definitely will come back next time. It could be great if the dish size can be larger. 3 people needs to order 4 dishes to get enough.
"I can’t say enough good things about this restaurant! It has been one of our favorites for many years and I love bringing friends and visitors here as well. The salmon is incredible, I also love the red cabbage, the Sultan’s delight and the appetizers (eggplant and cacik). The bread is always fresh and warm. We have been ordering a lot of takeout during COVID and its great although we miss the ambiance and the great people that work here. Thanks ABA!"
Bad service when my family order the food was cold we also ask for to reheat the food and the rice was dry sorry but 1 star
"Batura was no bad, buy the chicken rice were great"
The food is very fresh and delicious. If you don't try this food you missing a great meal.
"Food, price and service very good. Is recommended for New York"
Some of the best food I ever ate
"The waiter was exceptional, attentive,  suggested the meals and desserts of the day. Friendly and the food was delicious"
Really great restaurant! The food is amazing - authentic Mediterranean Turkish food. It tastes like home. The only thing I would change: please play authentic music!
Best bang for your buck
"Huge plates, Street tables right on 57th Street."
We went with folks who have been going here for over  40 years.  Good and service was very good. Arther Avenue bread is still the world's best.
First time eating there. I really enjoyed the food and drinks. And the atmosphere and service was on point. I will return and will recommend everyone to try it..
"Lovely place to go and GREAT salmon. Get the combo meal on the weekday specials menu. It's $16 for more food that either my friend or I could eat. All super tasty, too."
Authentic cantonese cuisine.  Best in NJ
Great food
great place. Mario is awesome.
"Great service (thank you Noah!), great atmosphere, and great food. What more can you ask for? My wife and I split the mixed grill and sides. Everything was cooked right and service was prompt."
"Food was excellent, but the maintenance is terrible. As soon as I stepped in the whole place had a weird smell. The floor was dirty so as the table. We had to move to another table by ourselves as there was no staff to assist. Bathroom floor was wet and tissues all over the floor. I guess Olive Garden doesn't even care much to this location. If this continues to go on then sorry olive garden."
Wonderful place. Great menu.  Seating is tight. Emily was our super server. Definitely will return. Suggest reservations.
It's a cool local spot with an extensive drink and food menu.. get there for the happy hour with $5 beers and bunch of other drink specials.    They had the 6-piece wing special for happy hour as well. The soy garlic is very tasty and crispy!  Their chicken wing business is on point!
I need a chance to work
"I have stopped going to olive garden long back. I was forced to go this time to use my gift card and boy it did disappoint as expected. Filthy place as shown. Food was below average. I just couldn't eat it. Wasted 80% of it and never bothered packing as I know I won't like it. The only good part was the desert. Other than that it was a dud. This is my last visit to olive garden. If I get a olive garden gift card next time, I will donate it away."
"Amazing food and great service. We were visiting NY from Calgary, Canada. I read reviews of this place online and decided to go for lunch. It was worth the walk. The servers were attentive and courteous. Would definitely recommend to friends visiting NYC."
I celebrated my wife's birthday and the staff did a wonderful job and gave her an unforgettable experience.  Great job Czen..  And the food was amazing  
"A little more expensive than I usually opt for, but great selection of menu items, presentation, and service"
The Food is great and service is awesome.
We came here for lunch. The food and the service were really good. I recommend!
"Good food but quite expensive, I didn’t like that they forced me to tip a specific amount with the bill. I never saw this in New York City."
The restaurant is much worse than it used to be. The owner and chef have changed. The prices have gone up and the portions have gotten ridiculously smaller. It looks like it's designed for a 3 year old. Yesterday we made an order and at home we saw that only 4 small pieces of shish kebab were included in the portion. All.! We will not go to this restaurant again and will not order anything. I will warn all my friends and acquaintances not to do business with this restaurant.
Warm welcoming friendly. Staff helpful. Excellent food quality.  Freshly made food and New York Latin flavor. Clean.
"Good food for a fair price. Unlimited soup, salad, and breadsticks. Service has always been professional. Looking forward to going back  …"
"Check No: 33719  Table No: 252  Date: 08/14/2021 07:44 PM  Server: Atoosa E  The worst service I have ever had.  This was uncalled for.  One must treat customers as one would treat their mother.  Never again will we eat at this restaurant.  When someone spits in your tea cup and thinks you didnt notice is bad.  We must be nice to one another and present the food based on the rules of the restaurant, the soup was cold, the tea had spit in it, did not get offered desert and the service was bad."
A go-to for my family when we're in the neighborhood. Always good.
Awesome pasta options. Truly an excellent dinner option in the city
My salmon was excellent.  The service was superb.  I will definitely be a regular.
Delicious food and always prepared quickly.  The only place I go to for Chinese food.
Elizabeth's best pupusas
Favorite restaurant in NYC!!!!! best food and best staff
"Nice place, very busy at night time. Food was good, very cheap as well. We had 4 people only paying 15 for a full dinner"
"Lovely place, great service  …"
Average food n service - ambiance was pretty good
Hands down the best dim sum in all of central NJ
I don’t frequent Olive Garden. This is only my second time going to one aside from the one in Garden city. The food wasn’t bad. Except we had to change our table. There were several micro ants on my side of the table . I almost didn’t notice. That why I gave it a 3. We got an apology which is great from the waiter but tbh the Mgr should have offered their apologies. I still felt a bit uncomfortable but I wasn’t dining alone. Overall it was ok.  The prices are decent and the lunch menu is good.
Everything was amazing! All of the dishes I had were delicious and the ambiance is so fun. Highly recommend!
Best pizza ever! I never knew pizza could be this delicious. My mother and sister both agree! If you have someone visiting you take them here and I guarantee they will be impressed!    Also a great spot for vegans! I highly recommend the vegan Buffalo pizza even if you eat meat!
"We had them cater for a small part of ten.  The food came hot, and plenty.  Everyone raved about the selections.  The person who retired, is a regular, said the food we got tasted just as great as sitting down.  Look forward to visiting back in person."
"Very nice am Queen o and sizeable portions! Viv Thai was exactly what I needed after a night out on Broadway. We got the Red curry and the Queen of Siam basil, both great options."
"I went to that restaurant with 2 other people. We order chicken roll, sausage hero and sausage roll. Everything was blend without taste. We did not enjoy our lunch. . Looks like they heat up the food in the microwave. The chicken roll had a big slab of chicken inside, tasteless . ZThe sausage was like rubber...    EWithout deadening"
"Took my girlfriend here for our anniversary and it didn’t lead up to expectations to say it kindly. The bread was gross. The drinks taste like Hudson River water, the calamari is better at the Olive Garden, and the steak didn’t have much flavor. I left almost as hungry as when I sat down to eat. The only thing the place has going for them is a nice wait staff"
Crab is fresh and good taste!
Food was very good.  Highly recommend the stuffed cheese burger!!
"Absolutely stunning place, great drinks. Food was just ok though. Menu was not captivating, nor food memorable. Staff was very attentive-perhaps too attentive. Not to be nit-picky, as I’d prefer attentive service than not, I just felt like I could barely carry on a conversation without being interrupted every few minutes. Overall lovely place."
"A great place to go. The food is special, and the Mujaddara Croquettes are amazing."
"Worst experience of my life, this is not a Greek place anymore. Cold soup, cold rice, bad quality seafood. Lousy service boring environment.  Back in the days this used to be captain Greek one of the best spots in Astoria. Will never come back"
I'm hooked on their breakfast
"This place is a hidden gem - if you're in the mood for a cheap, Korean meal (particularly great for lunch cause it's very much grab and go) this is the place to be. Pictured below is the kimchi fried rice and bulgogi beef. It's also 5% off your bill if you pay in cash and a $15 credit card minimum."
"Great food, very tasty and finger-licking. Very busy place for take out (upto 1.5 hr) so order ahead of time. I like the punjabi dishes that best. The Indo-Chinese dishes were just okay. We have already ordered 3 times just this month from Delhi Garden, that is how great it is!"
Delicius Amazonic Peruvian food!
"Good service, very good food."
I love this place. Very nice people.  Very delicious food. Good prices too and portions too! They also provide free Buddhist literature which I enjoy. Definitely my favorite place to eat.
My favorite sushi spot! Staff is amazing very welcoming and they always have a big smile when you walk in. #myfavsushispot
Received warm and great.service from the host and servers here. He seated us in the deck which was great because the weather was beautiful and sunny today so loved the natural light. The food was really good and I was very happy that I got my oeuffs de maurette (a Burgundian dish made with red wine sauce). Highly recommend!
"Read the menu..memorize the price cause when u get the bill big surprise!. Had bolognese rigatoni. Macaroni was hard as a rock, couldn't even eat. A lettuce salad was so overpriced. Took clients out for lunch 96.00 for 3 people and thought prices were different but did not want to say anything in front of clients. No alcohol. Called restaurant later in day, Owner was supposed to call me back. Never did. Will never return."
"Very nice restaurant, the service was spectacular and food was delicious. The alcoholic beverage were well mixed and not stingy with the alcohol. The servers were polite and precise with the orders."
Great place to eat !! You will never be disappointed!  Filet Mignon Tips they Melt in your mouth 
Sorry. Pizza wasa failure this time around. Good in the past. Tasted old and salty.
Great place to pick up galaktoboureko.
The Mac & cheese & fries was good. The wings were gross and the entree courses were not its best. Can say it is not worth much. The drinks were regular. My partner was also not impressed. Even the looks of the place I know it’s covid but the spot look questionable and old looking. Probably won’t  go again. Good thing didn’t take the person here months ago for their birthday they would of been disappointed.
Delicious food and atmosphere was great. Our waitress was very lovely. Definitely recommend this place.
"Great staff and very good food.  It is BYOB, so bring a few bottles of wine and your party will have a great evening."
"Freshly made pizza, amazing soup, great food!"
Was at a private dinner upstairs. Terrific ambiance and food.
"Just left my son and fiancee's engagement brunch party. Everything was perfect. Loved the space, the food and the staff. So happy we had a sunny day to enjoy the terrace!!Could not have asked for more. Highly recommend."
"Great Place!  had a fun night and the service was exceptional!  The owners greeted me themselves, and to mention the food was amazing as well! 5 out of 5!"
