"How this restaurant gets 5 stars is beyond me. Or.. rather, it’s paid astroturfing,    The portions are small, and the prices leave much to be desired. I was extremely excited to see more Asian options in midtown, but fam, this ain’t it."
I have been coming here since I am 15 years old. The food has remained consistent and fantastic for 33 years that I can recall. Love the Hop Kee …
"Great food, accommodating kitchen and friendly and helpful waiting staff."
"Good Thai food, fair New York City prices. The outdoor dining ambiance is beautiful, with greenery everywhere. The drinks we got were beautiful as well! Service was fast although our waitress seemed to be rushing us a bit - it’s a popular place so I think they are trying to move tables quickly. Overall, the food was good and the experience was positive."
"The line was long during lunch hour in the freezing cold right after Christmas weekend. The pierogi's were well worth it! Delicious, homemade, and reminds me of home."
The customer device is very bad. The food took forever to get here and it wasn’t even that good like.... …
I give it four stars i love the curry chicken everything was nice except the price $13 with like two pieces of chicken with a bunch of rice and peas no complaints about the food but the price im from queens living in the bronx i was traveling to queens for Caribbean food when i came across this place on google maps i can get a large plate for $10.50 with mad chicken and gravy with rice & peas over all food is good its the price 
"I had the 4 cheese stuffed burger on a ciabatta roll.  Good service the food was piping hot and delicious.   The decor is old and not updated since the last time I was there which was over 10 years ago, but I still enjoyed my food!"
Oysters is good. Fresh
"Great service, food was mediocre edible but not outstanding.  I had red snapper which was covered in a sauce disguising the taste of the fish. My partner had veal with artichoke which he said was just ok also.  Just not what we were hoping to get in NY. Wines were blah"
Our all time favorite restaurant.  Great food. All food on the menue exceeds expectations.  Old type of service from the entire staff. They make you feel very special.
Very good place to eat Dominican food
Great food options. Very delicious and tasty food
Good food. But i wish they had new tables and seats  some of they tables lean or move while eating..
Theyre over priced with poor customer service. I use to order here but the price of rice always changes.  Some meats are leftovers from the day before. I also made a purchase over the phone with my debit card. The next day i had an odd purchase of 150$ for a vitamin shop in jersey city.  The owner price gouges as he buys products at a high price from local convenient stores.  Its a shame the family makes good food but extremely mismanaged
Good place to have a Dim Sum. Very good dumplings.
They gave us a lot of fries and vegetables I wasn’t there to eat those things The sashimi portion was too small I should have gotten only sashimi Don’t get sashimi set
"Atmosphere was perfect. Great music,  beautiful art. There's a beautiful 3D collage of the islands that's truly captivating.  The drinks were great- loved the mango margaritas! The food was great too, but the salmon could've used a bit more seasoning.  The sauce it was in was divine,  it needed a little more of that.    Definitely worth it!"
Authentic Chinese
"I find myself ordering from here more and more.  Pad woonsen, basil sauce, spring rolls. I like this place a lot. Recommended for quick Thai"
"Great atmosphere, better food and kind, courteous staff. Most welcoming place in the neighborhood"
it's good and clean
The bartender there - the cute skinny one  was spot-on with her recommendation for the shrimp tempura sushi. Best bar pie around. Impressive selection of craft beer. …
Always fresh always good.  Great people great food
Ordered the roast duck chow mein it was nasty. The duck full has alot of fat no kind of meat. The rest of my order was good. When me and my kids got home we felt very nauseous and sick. The soda was over priced and the charged for refills
"Very good supply of islands products.. the cashier's personality was a bit cold.  Never had June plum juice..I live far away so I bought it, not looking at the date on the box... didn't  notice until reaching home it was expiring the day after I bought it.. please do better G.K"
4.5 stars - delicious Thai food!    Nicely decorated for a fun date night vibe.  Service was fast and friendly.   Only thing I'd take points off for were the cocktails.  The two we had fell a bit flat.
Worst Indian food ever. Too expensive.
"Food was below average, paneer served in the curry seemed to be from dead stock, not that worth."
Food is delicious but the service could be better.
"Great food, good price"
I had a clerical error hopefully it is corrected
"We had a large family gathering of out-of-towners to feed after an emotionally draining service at a local cemetery. The staff went out of their way to make us feel welcome and well taken care of. The food was outstanding and prepared to everyone's liking, which is not easy with 10+ burgers (well, medium-well, medium-rare, etc) being served at once. They obviously work hard, and work hard to find and keep excellent staff. Cheers to the Iron Horse!"
"The staff was friendly and the food was great. I ordered chimichangas and my friend ordered enchiladas. The plates were huge and full of the main course, rice, beans and toppings. You get free chips and salsa--yum! We also had the fried ice cream --wow, definitely make room for dessert. It was pretty empty when we went, so it's nice and peaceful there. They have a large flat-screen TV too if you want to watch TV."
Good food and price. The table is a bit small for two people (the waiter knocked the coke down by accident..)
Great food
"I ordered Spicy Cumin Mutton Lunch, spring rolls and hot&sour soup, to go. Mutton is very spicy with dry red peppers, very flavorful, cumin and lamb go excellent together. The meet is a bit smoky and very tender. Rolls and soup are pretty good too.  I don't know how good the service is, but the food is excellent!"
Only picked up gift certificates
Fake business.+8801782118031 WhatsApp
Food was okay. Male Server was distracted. Female server was bilingual and kind. They do serve Pellegrino and not just generic sparkling water.
Our family went to try this restaurant on a late Sunday afternoon on a relatively nice day. I called beforehand to ensure they had outdoor seating available on that day and time. We had been looking forward to trying the restaurant as they have advertised about their outdoor tent area. When we arrived the waiter said he wouldn't seat us outside because they did not want to go in and out to serve people.  What!!!?!?????!  We drove over 30 minutes to get there and had to turn around and head home.
"Good food,  orders done to liking"
"Very good bbq, fast, clean, good atendance"
"Nice little spot off of Kings Point ! Friendly staff and quick service. To start they serve fried yucca with a delicious Peruvian green sauce. The lomo is delicious , it contains French fries and vegetables. Avocado salad has a creamy garlic dressing , fresh lettuce , avocado and tomatoes! Sangria has a great taste and perfect amount of strong. Def recommend for a date night or girls night out."
"Beautiful interior, nice bamboo wall in bar area, nice decorations.  Good size portions, not the skimpy portions some places serve.  Very friendly, attentive staff."
The emperor has no clothes. Yet another over hyped restaurant where patrons confuse the prices of dishes for quality. The service was terrific.
"Always love coming here.  Hasn't changed in 20 years and that's a great thing.  Food is always delicious, services was great! Highly recommended!"
Delicious food ! Was surprised if how large portions were this is old fashion eating!!
Pork soup dumplings taste so good.  But Do Not expect to their service..and lighting color is uncomfortable.
limited lunch menu. Quality is good and does get busy so if you are creature of habit and find what you like here and just get that each time it can work. If you are like me and get bored with the same old... then you might want to try once and move on.
Food is good and reasonable. Staff is very friendly.
"Great restaurant in Chinatown that offers authentic Chinese cuisine. Menu has photos as well as English descriptions of each item, so visiting tourists won't need to guess what each dish is. Wait staff mostly have a decent grasp on English so this defintiely makes it easier to order. Does get a little loud around dinner time."
Excellent food people atomosphere
"Incredible first experience at this establishment!  First off, our waiter was the best!  All of his recommendations for brunch were outstanding from drinks to food!  Will definitely return for dinner!!"
Best birria tacos!!
"I would imagine people come here to drink the alcohol, because the food and service weren't good at all.    Our order of Cold Sesame Noodle was served hot. We had a Chicken Curry dish which was more of a soup. For food, I'd avoid this spot, it's just too bad I'm not a drinker."
Large portions and close to Bergen Pac
"Love Poke! Great service, excellent food very consistent."
"Nice atmosphere,  good food and a very nice bartender too"
"Great place but owner/managers are terrible. I always try to give this place a try but it’s so ghetto. Owner and security allowing customers to walk around the restaurant without even being confronted and act crazy as people are sitting and dining. I come to party and have a good time, the food and drinks are good but I feel like its A free for all there amongst staff. Last month I came and sat in a blue booth and witness ppl owner and customers carrying on as if it’s not his place!"
We do not like the condensed new menu and the captain waa rude when we explain that we prefer previously they had more steaks selection and asked us if we prefer to leave and eat across the street. Food was good not great and after this time we will never return. Vibe is bad
The wait was horrible. Took us an hour to get seated and an additional 20 mins to get served drinks not food. I had my 2 toddlers with me but luckily as a mom i had snacks and drinks for them while we waited and ended up taking their meal home. Smh never again! I would have appreciated it if they were honest n told us the appropriate waiting time than continually saying 10 minutes more.
The food is excellent certain servers could be a lil rude.
"First time trying Cuban/Dominican food and was not disappointed! Went for the oxtail with yellow rice and black beans and a cheese empanada. Everything was delicious, especially surprised how tasty the rice and beans were as I expected them to just be *there*. The cafe con leche absolutely hit the spot too. Service was quick, patient and friendly - would highly recommend if you're in the neighbourhood."
the service was great!!  and the food was great To!! 
Environment is still the same after all of these years...need a little updating in the entrance area....food was ok not great like before...waitress not attentive enough...bar was overtaking the restaurant portion with loud music which wasn't up to date....ambiance  was still alright
Great food .
"A small gem right in the middle of Hackensack.  Food is great and service just outstanding.  Those fajitas come out so hot, omg!  Loved those shrimp tacos."
"I really like this restaurant. The quality of the food and the cooking are top notch. The prices are in line with other Indian restaurants. As far as atmosphere, it is very Indian. The lighting is a little dark for me, kind of a romantic feel. The music is a continual loop of, ""I'm guessing"".Hindu chants. I have only been to SoIR once, so I'll leave an updated review the next time I visit."
Great Chinese food from Guyana
"If you order chicken fingers and calamari, you expect it to be crispy, but they were soggy. It made us wonder if it was microwaved or fresh made.    If you have a family member that eats cod and knows what good quality cod is but tell you don't bring it home, it is a bit concerning especially if you are a pregnant patron."
Best asain  pakistani food
Good portion sizes and tasty food
Very delicious dishes with reasonable prices.  I got the special bun (rice vermicelli dish) and as always it was spot on.  I thoroughly enjoyed my experience here.
Excellent as usual     I have been ordering from Albasha for over a two years     They sell fresh and authentic Mediterranean cuisine and honestly they are my go to whenever I am craving a mixed grilled plate     Weather weekday or weekend and craving a Mediterranean food adventure is my go to restaurant 
"The staff here and super racist and stuck up. We were a few minutes early for our reservation and they wouldn't seat us and were rude to us. They were nice to all the white customers that came in after us. Such horrible service, don't go here."
OMG! Great food & prices too
Food was great and service was on point.
"Great lunch too. Porchetta sandwich is amazing, moist pork, great pickles, perfectly toasted bread. Fries are also incredible"
"I love Olive Garden, and this location was great! Even we waited for a long time because it was very busy, our waiter gave us an awsome service and also all the waiters sang Happy Birthday to my best friend (It was her first time at Olive Garden and first time visiting this country) she loved the experience.    It looks like all the employees have a great work environment, and they look very happy and united."
Varieties!!!  The main Hispanic food are served here.  Food is great and price is reasonable.  Service can be slow at time which can cause long wait.  Overall good restaurant
Aways good food and great waiter staff. Clean neat and well worth the visit.
Great food
We have very few good breakfast places close to us  This is a great place to experience good food and service...GREAT breakfast !
Very good food and portion are realy big.
"Great food, good atmosphere, very nice employees too. Thanks for always coming thru in the clutch!"
"Quality Chilean food, pleasant atmosphere, excellent service, recommended. Takeaway, consumption and home delivery."
"The entrees were extremely good. The main dishes were ok, and there is a nice offer of wines. The staff is very friendly and helpful and the restaurant as a very nice vibe. I would have liked if they had given us a slightly bigger table, a hit tight for the nr of people."
No water for you......refused to give us water untill we buy either the bottle water or the poured one....place is hotter than being outside in the chinatown sweltering heat
Too long line but ok if you compare the price
I cant say anything bad about carmines I arrived on time for my reservation and me and my party of 3 were seated promptly the waitress was very attentive the food was excellent all very large portions so do not order a plate of anything and expect to eat it by yourself you can try it but I doubt it very seriously it was slightly chilly inside which can be uncomfortable oh yea if they could toast the Italian bread instead of it being cold that'll be awsome but I'm just nit picking now great place great food
I have been eating here for 15 years. Never disappoints. Friendly owner and fabulous food.
"It has been our most frequented place lately :) A friendly team, delicious food, an immaculate place.. I highly recommend it."
The food is delicious and the portions are great
"Wifey and I were here prepandemic and absolutely loved it. The ambiance, the food, everything... great time,  now I see its reopened and you know I have to set a reservation to go again ASAP!"
To spicy and expensive.
Good food
"elegant dining room, sophisticated table setting awaiting you,  superb and imaginative food preparations (seared foie gras over divers scallops? oh, my!) and team service attentive to the point where you feel like you are the only guests in the room. how belle epoche is that?  the whole evening in this restaurant was exceptional; it felt like a command performance for a truly special occasion."
Fresh food and friendly owners.
"Beautiful ambiance, wonderful energy in the dining room. Food was excellent - the tilefish was exceptional. Our wonderful dinner was only spoiled by our waiter John's passive aggressiveness. Not sure why he was in such a bad mood, but he was being extremely rude. Not sure if we will return due to the service."
"The service is unmatched. The staff truly cares about your experience & The food is absolutely amazing I had the pleasure of being served by Shannon she’s the best, definitely will be going back."
"This restaurant is so cute! The inside is very fun, but a little loud.  We were lucky to get an outside table in a private seating area that was adorable.    The servers are very friendly and outgoing.  The presentation of the vegetable spring rolls was very creative and they tasted great!"
So happy to have a good breakfast spot so near to my park slope apt- the only other options are bagel bakeries (I can only have so many) or mediocre diners. The Latin soon on many of the dishes is a welcome change.  Eggs are well executed and well seasoned. Chocolate chip pancakes FTW!
Been coming here for years.  Everything I have ordered here has been delicious!  Very vegetarian-friendly.  Incredible Sunday brunch - so much food you won't be able to taste it all.  Friendly service and non-stop water glass filling.
Excellent service and very good food.    We had dinner here on Tuesday evening based on the Google reviews. We had an excellent waiter and it’s a really cool location. They have several dining rooms and even an amusement park of some sort in the back.    I thought the food was very good. The steak was cooked correctly and the rice/chips were interesting. My buddy said the short ribs were on point.
Always.love love love olive garden. Our waitress was top notch. Cant remember her name but she was super bubbly and pleasant and helpful. She even kneeled on floor and packed up my To go badge since there was a lot to bring home.
Transitional Chinese Sichuan spicy food.
"Always a solid choice.  Plus a fun place to bring out of towners, food and an experience!  You  have to be a little agressive to get the items you want, but that's half the fun."
"Great little place to grab some quick variety of packaged dishes like seafood pancake, takoyaki, eel over rice, Bulgogi, banchan, hot soups, etc.  There are high tables and seats for you to dine in after purchase and a cute little microwave in the back (pay to use).    They offer 8% off if you pay in cash."
"It has good indoor dining, beans were horrible and falafel was ok.., wasn’t worth it, but it’s nice place to dine in with your friends"
Great food and service.
Good quality Sushi at this restaurant. Service is fast.
What a nice surprise. I'm happy they've been in the neighborhood for so long and I'll be going back soon. Try the port wine is fantastic!!
"Great food and very  reasonable price, Excellent service,  100% recommend."
The place does not have a good staff.  They hired a bunch of kids that don't even know how to wait on tables. We sat there for over 15 minutes waiting to be asked if we wanted something to drink. Then at no time did they even return back toask us if we needed anything else. They did the same thing to the table right next to us. We had to ask someone to come by just to get water refills! Ridiculous!!!
"I'm a big fan of olive garden and Italian kitchen overall. This used to be a good olive garden location but not anymore. The waiters were not friendly at all, the place smelled bad, the food was not good. What mostly bothered me is that servers were not wearing anything to cover their hair while carrying food. There were literally girls carrying a tray of food and their hair was falling inside the tray! That was disgusting. Thankfully our food was brought by someone else. Overall not a good experience."
Definitely won't be dissatisfied.  Food is on point.  One of my favorite places.
"Always delicious, freshest hummus around!"
"This Place is in Parsippany NJ. We went here after a lot of positive reviews about the food and the place did not disappoint. Would have given a 5 start but their crowd management is plain pathetic. Coming to the food, do not miss the paneer fries and the appum. The Mysore masala dosa was great as well. We ended on the pineapple dessert which was mouth watering. Definitely recommend this place but should try to visit on a non occasion day."
"Yesterday, we hosted our Christening party for  little Jon Michael.  Family and friends all agreed the food was great and the service was excellent. Thank you for a great experience! Excellent value!"
"Classic neighborhood Italian. If what you want isn't on the menu, ask and they will try to accommodate."
Good place for Asian fusion.  Lounge feel and excellent view of Manhattan from the near by park make this a great place to bring visiting friends.
"This is a great classic, you can return to for an ADULT, SERIOUS DINNER. We went with a large group and were treated like royalty. This place only hires pros. No actor/model wanna bes who are waiting tables as a gig. This is the real deal and the food is perfect - the beef on the bone was incredible... the lamb... the pasta... the burrata..."
Love the Brazilian food
"It was recently my first time ordering from here and the food is amazing!!! The chicken & waffles were amazing, will be ordering from here again."
"This place is great!  The food is delicious and the service is great, very friendly! I highly recommend eating here."
"the food was not up to par. the place looks decent, but it was not to our liking to sit and eat"
"I eat Tony's pizza 2-5 times a week. These guys hold it down big time. The pizza is good, you have a lot of choices. They are legit to deal with too, you know it gets hectic in there and they keep things running professional. I love Tony's."
"Friendly staff, tasty pho with a uearty portion size.  Will come back to try more of the menu"
"I was getting takeout. Service was horrible. I was already in a rush, waiter tells me my spring rolls would take only five minutes. After I make the payment with the cashier, he tells me it will take 15 minutes to make TWO spring rolls and ONE avocado shake. The springs rolls (made of noodles and shrimp and raw chickem) tasted disgusting. Noodles tasted raw. Shrimp tastes like it was frozen. AND it took 20 minutes to get my order. Absolutely horrible."
"While the view was pleasant,  the menu very limited and far too pricey.  For brunch you're paying $17 for eggs,  no drink,  no coffee,  nothing!  Add to that the service was awful.   Very disappointing. I watched one man at another table get up three times to get the waitress.  They waited 20 minutes for drinks only to have  the wrong wine brought over."
"Awesome restaurant. Great food and ambience, huge dining room you don't often see in the area."
"Love the family size dishes; each dish is plentiful. When you do order, each dish serves 2-3 people. For a table of 2, I suggest one appetizer, and one entree. There will be more than enough to take home depending on what you get. The staff is very attentive, and professional. My food choices of Baked Clams, and Pene A La Vodka with Chicken were very good."
Great food a huge selection to choose from.  Staff is very friendly.
Nice place great food!
"Excellent food! Lucky to be seated into the last seat on Friday. The service was a bit slow  at the peak time understandably. The atmosphere feels like the one I visited in Madrid area. Overall, the place is a must to experience. I'll definitely to be back here many times."
I loved the bar area and the drinks were excellent.
I must say Iam never disappointed with eating at this place food is always delicious very friendly place I will be visiting soon  …
Good drinks
I was there for a birthday party celebration. The food was awesome. I would definitely go back to eat again.
Ordered from there and it took them 1 hour to deliver my food just for my food to get there and everything is not in my bag they missed a whole platter and another one of my platters was wrong not to mention that I repeated the order twice and then the lady who took the order repeated it then when I called them back to let them know what was wrong they said they were going to send someone out with the corrections to my order and no one came
"Was there for a Christening. Food was delicious, service was exceptional!"
"Tried grilled beef and it was good. Not the best but pretty good. Thai ice tea was also nice, not very sweet."
"Amazing food, service and atmosphere! Best paella I have ever tasted!"
Great food - especially liked the kitfo.
My first time at Evelyn's was amazing! I told the bartender to give me a suggestion and he mixed me a delicious drink. He was really friendly and I'm definitely going back for the customer service. I definitely recommend!!
"Great atmosphere, love the decorations. Nice lighting, menu has pictures which os very helpful with deciding on the dish. Duck was nice and crispy. A little dry bit the crispyness made up for it. Thai ice tea was great. I recommend coming here as a date or with friends."
All you can eat sushi for $27.95.  Handrolls are fantastic.
Loved the food and I had a great time. Chicken gyoza was amazing and I ended up ordering a second order of it. I'll definitely come back to this play. It's a bit pricey but the food is delicious and a great place to take a date. Highly recommend it.
Quality food and good service.
"Excellent service, and exquisite French cuisine! Whether you grab a table in the front cafe/ bar area, or stay in the restaurant itself, it’s an exceptional ambience for meeting with friends or business colleagues."
