"The food was delicious, drinks were perfect. My daughter love the oreo dessert, she said it was best dessert she’s ever had. Thank you."
You can taste the quality
I hadn't been to the restaurant since it changed hands. Everything was delicious!
Other reviews describing it as hole in the wall are totally right. They are also right about the great food and friendly service. Lots of locals there for lunch and if I was a local I would be a regular as well.  Also probably the cheapest meal we will have in the city.
"I remember the salad being better. I did enjoy my endless soup, salad & bread sticks however just didn't seem as good as I once thought it all was ( years ago different location). The staff was all very friendly and the restaurant was very clean."
My family and I were in search of a good Dim Sum restaurant near us and we were so excited to find one. We went on Sunday morning and it was very busy but definitely worth the wait! The dim sum were delicious and everything tasted so fresh! We will definitely come back soon!
Pastai is a super cute dinner spot in Chelsea. I've walked past it countless times so one night a friend and I decided to finally try it. I got the bucatini for an entree and tiramisu for dessert. Both were simply amazing. The portions were a bit small but it's NYC so it's to be expected. The server gave us a complimentary round of shots after dinner which was much appreciated.
Great place
Food cold
"I used to go to this place for years when I worked over in Iselin. What happened to Meemah?  The place has changed since they got new ownership. They are not friendly. The greeter was unwelcoming to me and 1st time guests. The waiter was rude and snatched the menu from my hand and more over they over peppered my food because the food was too spicy to eat. And the quality of the chicken was spongy. I would never go there again. If I could give them Zero stars I would.  So sad, it used to be nice."
Delicious Ecuadorian breakfast!
Food is great and service is wonderful.
Amazing place. Atmosphere and food. Outta bounds
"I have been coming here with my friends and family for a while now. The food is great! Consistent, every time we come!  Great people, Great Food, Clean and Great service! Stop by and check them out! Recommend ...chicharrones de pollo sin hueso(popcorn chicken) or the barbecue chicken!"
"Authentic food, best I've tasted in a while. Wonderful people. I come here at least once a week."
"Food's pretty good, servers mostly nice, service is consistent, prices not too bad.  Have returned more than once, will go back again."
Wonderful place. Great service and great food. Can't say enough how much I love it here.
Good food and homely environment.
La comida omg was so delicious
"Don't come to the NY/NJ area without stopping here! If you CRAVE authentic halal Pakistani cuisine, then this is your place. The restaurant is cozy and warm. The service is excellent. Saddam was waiting on us and did an great job; was fast, polite, and attentive. We ate so much food, and the bill was very reasonable. We'll be coming back for sure!"
They have some quality food and the seating area is pretty quiet. We liked their food and my kids enjoy it. I strongly recommend this restaurant. The price of their foods are little high.
3 of us dined. Beers $6. We had 5. Two Pina colada 12$ we had 2. Ordered shrimp fried rice and chicken lomein. Food was very sweet  like  It was cooked in sugar water and the bunjal gizzard ..well hmmm .bill was 123$ includes service charge .  A very terrible experience.staff was nice ..place was clean...but food and price was horrible..No reason ever to go back there.
"I've always liked this place.  There was a huge price discrepancy between menu online and actual price.  I know theres inflation and all but come on.... for example, online showed 12 bucks for the pho, then you get there they tell you its $20. Or when you expect vietnamese sandwich for 8.95 but you get there its $12.   Im not as mad about the actual price than the price disparity.  Ridiculous."
"Our server Mimi was professional, efficient & excellent. She refilled our water/drinks w/o any of us asking. We tipped her generously bcuz of her service."
Burgers are still great!!!
"I have been here numerous of times and each time was a great experience. You can taste the freshness of the food. All the salads are always extra crispy and fresh. Their chicken parm is amazing! Everything about this restaurant is excellent. The portions are so big. You pay a decent price and get left overs, not too many places you can actually say that about. The owner is very friendly and always there greeting you. I would recommend this place to everyone!!"
Best bangali restaurant in Newyork..we impressed for their food and behavior…go for it… …
"The best place in Staten Island.Delicious food,great service,nice music.Also,good place to celebrate any anniversaries,weddings,birthdays.I recommend to visit this Restaurant and spend good time."
"Way overpriced: $120 for a 2.5-pound steamed live fish (marble goby fish), $68 for the lobsters with ginger and scollions."
"Great place. A bit on the pricier end, especially when considering the small serving size. The food and service were great overall, and worth a visit!"
Delicious food and good service!  We dine at Hunkar very often.
All the food we order was very delicious. The restaurant was busy so the servers were in a fast pace and may seem little rushing but it was understandable for us.
Really good!
Went to eat with the family & every meal was super delicious! The name fits perfect.
"The Penang curry chicken is to die for. Get a side of roti, dip it in the sauce, it will melt in your mouth and you've gone to heaven. Warning, spicy ahead. But so, so good."
Great place to enjoy Turkish food. Has lots of options in both vegetarian and non vegetarian. Must try are tge kebabs and the Turkish pide. Turkish tea on the side will be great too.
"I highly recommend this restaurant . The staff are very professional and friendly especially Celik. You would think that the staff own the restaurant. Food is amazing.  I love their soups, appetizers, and spinach."
"Enchanting garden, atmosphere draws you in as soon as you enter. Two floors of candlelit cosiness, excellent food, wonderful and friendly service. A great bar downstairs to have a digestif over candlelight. A wonderful night"
"One of the best Asian fusion food place I’ve been to. I would definitely say it’s better than Sagar. I’ve personally had the pleasure to meet the owner too and he’s actually such a genuine and cool owner. And finally, the food is to die for. Best Asian fusion Bengali food I ever had!"
"Best place ever! Food is delicious, service is fast!"
Excellent attention
"Amazing service and food, we had a beautiful view"
This is absolutely the worst all you can eat place ive every been to. Ridiculous rules eg. I cant share food with my 3 year old ddaughter...so if my baby ask me..daddy let me taste that..ill have to pay an additional charge for her..yup your reading right...oh an if you leave any rice on your plate...that's an extra charge as well..
I’ve been here twice now and it’s been spectacular both times. Reasonably priced fresh produce. Friendly staff and a warm atmosphere.
I like to bring my family here for a taste of home. Shantha made our last experience very enjoyable we appreciated his patience and kindness.
Great food and fast service
"Beautifully decorated place. We were there for brunch. The dishes looked promising and although they were technically cooked to perfection, they just fell flat on flavor and even seasoning. One time visit."
Delicious and authentic. Great and kind service.
Was okay. Vegetarian option was not very palatable so had to gobble up the dessert
Good at Edison Pizza is excellent!  Eddie is an excellent server!  Highly recommend this restaurant!
"Neat, quick, and professional. Just stopped for a quick appetizer after shopping and heading to the hotel.  Looks like a good suit and tie place!"
"Great food, fast and friendly service. If your looking for real Mexican food, this is definitely the place to go."
"The menu offering was impressive, something for everybody but the piquancy was not there. I understand it's tough to get the South Indian flavor here but A2B was not up to the hype.  Nail in the coffin was the dreadful coffee that was served in a traditional South Indian cup but tasted like coffee flavored dehydrated milk powder."
"Matzoh ball soup, potato pancakes, pierogi are an amazing. The braised meat and cabbage/mushroom were my favorite!"
Good food but need better service
Always spot ion with taste and great ambiance
"I was upset Bc they charge me the amount that they want as service over the bill, this is something that you have to choice, the food is okay nothing especial, but it’s annoying that They put the tip that they want!!!"
We waited 2 hours for our food and we traveled all the way from Albany ny.  That's was totally unexceptable and some of the food we ordered and paid for was not in our bag. The food was tasty.
"Great bar, nice a dark no flashing lights. Great juke box.  Bartenders are the nicest. Prices are the lowest"
"It's like your MOM made everything! pancakes, spinach pie, chicken pot pie, soup etc. ALL EXCELLENT"
I enjoy this plae. Small but clean and food is Great.
Best Mexican restaurant in perth amboy!!!!! I've tried them all and the tacos here are amazing. Food is authentic and customer service is marvelous. Come check them out.
"This is good Location in Jamaica 169, There r lot of Grocey Store, Restaurant, So any Muslim people specially Bangladeshi people can take Halal Food & take out from these Restaurant."
"I tried the fish tacos and they were so good! You get three large tacos! Only street parking is available but for the price and portions, it's so worth the trouble."
"Even though the waitress was very nice, we didn’t enjoy the food. The food was tasteless."
"Music too loud, food ok, waitstaff good. Ok for a quick soup & salad."
"Opted for curbside dining, staff friendly but the food was disappointing."
"Could be the best burger in Manhattan, I was going to cut little bit of manager’s attitude but the taste overweighted his approach. Outside cabins are just for 2 people but the other side can serve more people with heath, ever it was 40F, we were able take off our coats and eat comfortably."
The food was good and the service was also. The kids really enjoyed it
The quesabirria and birria tacos were amazing would definitely recommend to people who are new to the restaurant!
Best Restaurant in this town we try charsii karahi and Goal Ghappa chiken Tikka and Naan all food And appetizers very tasty and service very Good
"My first time at Olive Garden and the fam was pleasantly surprised.  They were very busy but the waiter tried his best to be attentive.  Seems he was also trying his best to fake an Italian accent but it wasn't very good. :-)  For was very good.  Better than we thought it would be, expecially with them being so busy."
Sat for 20 minutes and no one served us. Wish we could have tried the food but had to walk out. Tables that came in after us got food and drink and we sat there like we didn’t exist.
Casual and friendly with solid food. Casual but comfortable outdoor seating.
Thoroughly enjoyed our dinner. Great and welcoming hostess and servers. Dinner was filling and very good. Can't wait to come back and try other options.
"If you have a problem with Pho One, it’s you who has a problem because this place is amazing. Me and my mother come here regularly and it’s the best pho I’ve ever had."
"Excellent food in a charming neighborhood restaurant. Casual, family-friendly. Service was friendly, attentive and very good. A bit pricey but the portions are substantial, sangria is excellent. A little bright, a little loud, but all contributes to the happy neighborhood vibe"
"Nice setting.  Great service, trendy Thai restaurant close to the theater district and hell's kitchen."
Always the best food
Well for meat lovers this place is just out of heaven
"Great place, great food, great customer service"
Really good food!!
Food was great and staff was attentive. My friend got the bento box and I got the bibimbap. I finished every drop!
Roast Lamb fried rice is amazing!!!
Ordered for the first time today. got chicken burrittos. i must say they were great. what a real burrito should be like. and you cant beat the price. delivery was quick.
If your restaurant closes at midnight why not post that the kitchen closes at 10pm. So that customers don't think that have time to have a quick dinner when. They arrive at 10:06pm to be told the kitchen is close.  Nothing on the website!   Thanks Echo for a wonderful dinner.
"Good music, good food, good drinks"
"The service attitude is very poor, the dishes are very unsatisfactory, it is not recommended to visit again."
"One of the worst place in China town.  Foods are just okay. Not bad not good.  But too pricy compared to others there.    So arrogant servers.    They were kind, but a server requested more tips.  I didnot. He threw away his pen onto his desk. Very rude.  They want me to tip on togo items too with 15%. What? ???  Customers can tip whatever they want.  A bad experience."
"We went for ""Date Night"". You cant beat, a bottle of wine, salad/soup/ appy, main course,a side to share and dessert for $99.00! Service was excellent and the meal was excellent."
"Five stars is not enough. We drive from NJ just to eat here. You can’t go wrong with anything you order. The food is authentic to the Basque region of Spain. Kudos to the chef. The staff is efficient and friendly. We are salivating thinking of the next time we go. By the way, we always go on weekends for lunch and order food to go for dinner. Just can’t get enough."
Sushi is pretty good. Just a note that rolls come in 6 and have seaweed on the outside.
Great pizza totally impressed !! Yum a must try.
My family lives in the neighborhood and we order from Amitabha on a weekly basis. The food is amazing and 100% vegan. They work some magic on tofu and seitan as a substitute for meat. Our favorite is the BBQ vege roast pork with Cedar fried rice.  The owners are very friendly and are always giving my parents advice on how to make healthy vegan meals at home.
Food is amazing... fresh and delicious. Lamb roast and sizling salta my favorite.
Our waiter was really great and the service impeccable. We enjoyed our food and the drinks were delicious (classic lemonade and mango/strawberry iced tea).
The food has a great taste but the ambiance was not that great the music was to loud and was not that great there were other clients the were really loud also and  the staff lady she was like tired or so not sure she treat us fine but i think she needs to get better
Tasty Turkish food. Highly recommended.
I ordered the Siracha noodles and they were incredible! The flavor was amazing and the amount of chicken added was great! Will definitely be coming back.
"I had a great experience. The owner came over to see if I was enjoying my food. The food was so delicious, I ordered some to take home."
"Probably the best and ""only"" indian in the immediate area.  Food is good and lunch prices are reasonable.  Parking is easiest in the back parking lot."
the food is good but inconsistent.  on some days it's super tasty and on other days it gets bland.
A wide selection for Korean & Asian food groceries. Price is reasonable. Its food court offers variety of Korean meals. The shopping environment is bright and clean.
Beautiful restaurant ambiance  Food was good - nothing mind blowing based on what we ordered (all vegetarian) but would def recommend and come again
Been a staple to the neighborhood in the good years and the bad and has always kept its door open and its food fresh thank you  for years of good food and great service AKA Victor
"I hadn't been to an olive garden in so many years and I am so happy at the pleasure of coming here for the first time in a long time. The service was amazing along with our waiter, Kevin and the manager, Sean. Everyone was on point from beginning to end. The food was amazing and fresh. My friends and I will definitely come back again."
Food was delicious!
Always Top Notch
Good food and great atmosphere. The food was good. Less veggies options other than salad.
Amazing from entering to sitting to eating. Moment we entered hospitality and my waiter Juan introducing himself and service ...DRINKS MADE WITH LOTS OF Food was perfected. Street Corn must have. RICE LIKE MAMMA. VIBE IS 1000% ALL I HAVE TO SAY IS GO AND TRY . IF YOU ARE DISAPPONTED COME BACK TO MY REVIEW AND ROAST ME...LOL
Delicious and affordable!
I went to celebrate my sister's birthday and what an incredible restaurant this is!  Also the music and vibe is perfect.
perfect I did come today with my Algerian friends and we liked the food so much thank you guys
Amazing experience! Service is an absolute delight. Food is fresh and so delicious. What a treat of a place.
I can only appreciate the delicious Donegal Salmon me being Northern Irish.I have yet to find better any where else.
Real taste of Pakistani n Indian foods. I loved the environment and warm welcomed.
Ask for their specials!
Love the food and service!
"Food and wine is GREAT.  BUT:  it took them 50 minutes (actually still waiting, could be more) for them to prepare my meal. And they are not even busy. Not coming back, they take too long and offer you  more and more wine so you end up paying more, do that with tourist not with locals."
"Having dinner at this restaurant is an unforgettable experience from the moment you step through the doors. The decor is mesmerizing with extravagant details, 20+ft. high ceilings and an incomparable ambiance.  The staff were friendly, knowledgeable and professional. The music was soooooo good and the food was beyond delicious. This restaurant is a must-see and the food is worth every penny."
Excellent take out restaurant. They do have a small seating area but I'd recommend a take out. Call ahead and your food will be ready when you get there. The portions and the flavors were big and the prices low. Their summer special Lime Soda kept us coming back. Highly recommend this place.  …
Love this place!
"The food, decor, ambience, wait staff,  neighborhood was all Amazing! I"
the food is fabulous and the family who owns it are  wonderful people always making sure each guest is treated like family.
Very rich empanada..
Loved  the food. But I still had to wait a while even though I had a reservation. But to be fair we were missing a person from out party.
"One of our favorite spots in the area, they always have everything we're looking for & the store is very organized. & we can never leave without stopping in the bakery first, soo good! Also very impressed to see the precautions they have set up up to combat the virus."
"Freaking love the food here, everything on their menu taste freaking delicious and the service staff are the best. The prices are very affordable and its a great place for the family as well."
My wife took me here as a birthday gift. We caught the show murdered by the mob. A murder mystery dinner. Pretty cool experience food was good.
Plentiful and delicious lunch buffet. Food is incredibly flavorful. Best Indian food in Bergen County.
"Great consistent food, beautiful atmosphere.  They do need to retrain the waiters.  Last night we were told he had a partner however we never saw him.  Didn't get bread till halfway through the meal.  Asked 4 times for water and finally ordered a bottle.   Waiter started off attentive but then we was no where to be found.   I love this place but this will bring them down"
The food is very taste and i would like to suggest the people to have food here..
Excellent restaurant   Loved the service and food was amazing 
I don't need to make my own poke now.
Great rustic feel once you enter the establishment. Staff was really friendly and accommodating.  Food is delicious and proportionate. Stuffed burger and mango habanero wings are delicious.  Check Groupon for deals.
Nice food.. great service
"Our server was very attentive but almost halfway through my food found a long human hair in my plate of pasta. Workers should wear caps inside the kitchen. The hair was well mixed in the food, there was no way it fell there on the way to our table."
It was great and the and the food was delicious definitely a must go
"Food is pretty good, service is slow and inattentive and hookahs are below average. Go to Kamils, Mazaj or LaZiza. Even getting the check here takes 10+ min."
This was a very nice Family Restaurant. You feel at home as soon as you walk in. And the owners treat you so well. Great Cuban food and latte!
Always great food...pricier now but at least portions have been same.
"Amazing food, Amazing Drinks, Amazing Vibes! Great Prices! They need to expand down to florida! This food is amazing.. wait did i say that already? Make sure you get the Nut Cracker & if you're feeling a little nice... then just make it a super nut cracker... Thank me later."
"I had a great Sazarac to start. The pre fix lunch was a deal. The duck was tender and flavorful, complemented with the flavor of fruit. The chocolate cake was different than expected, more of a pudding texture than a cake. I would try a different desert next time."
Excellent dirty martinis (with Hendricks). Would recommend!
Served by barbers. Best uniform ever seen. Take a photo with over 60 years cash register. I did.
Great food and the girls are nice. Sucks that they don't deliver
Excellent proportions of food. Good price. Nice location. Good service. Must try their fabulous home fries.
Cant believe I broke my diet for that steak burrito… people were nice. my order was wrong. the steak was dry and terrible cut of meat for this purpose. Will not try my luck again.
I got the duck comfy and loved it! Decent portions too. The restaurant decor was awesome (I especially liked the giant bank vault door) and service was great. The mixed drinks are on point too!
"Excellent service, delicious foods and so clean and frendly atmoosfery"
"This restaurant may have change the owner recently, now it's very bad in food taste and cleaness, plus the prices are very high. Don't recommand to take out ot eat there."
"Friendly staff, food order came as requested and in a timely manner, place was busy, but very well managed."
Our waitress Jessica is and was amazing as usual. The food was incredible especially my favorite tuna cones. Tried the tofu ramen bowl for the first time and it was amazing!! Doesn't taste like tofu!! Can't wait for our next experience and new dishes
"I held a large group event here and everything was excellent. The service was great, the food was top notch, and the venue worked great for our group of 40. Highly recommend for anyone looking to host an event in mid-town."
"The Qianlong cabbage is a bit too sweet, but the rest are delicious, especially the fish dishes. The fish is very tender and well seasoned. Boiled and sweet and sour are both delicious."
Great service and staff! Made it in time for the lunch special and it was great. The smaller sizes were perfect and it's a shame it's not available on the regular menu for those with weight management concerns. Great waitress and hostess- we tried a new wine (remember to ask for your wine sample) and ended up buying the bottle. It was cheaper for the 3 of us. Well definitely be back!
Their food & drinks is soooooo good 1 of my favorite restaurants. And the prices are amazing
"Great taste, good service, great atmosphere. Portions are smaller than expected, at least for the special rolls."
"Love this place! Pleasant service, great cocktails & the tapas are fresh & tasty."
"The shrimp tacos had about 4 shrimp rum goo however price went up cups got small, no white meat The atmosphere outside nice they also took temperature good job. Made me some shrimp at home the best ever."
"This was my first time back at Gotham after they reopened. I was only at the bar, though of course the drinks and the food were delicious. The renovations look great and the staff are all top-notch."
Food was ok-to-good.  We ordered tacos which were small.  Everything could've used a bit more flavor.
Nice food  Good customer service  Surain thank you for your good service. …
Having very fun with girls night with freshness;)
Very solid pho in this area. Recommend
The food is horrible can’t lie even the wings were bad very salty and tasted like an old batch reheated
"Great Ambience, nice And quiet place. No loud music. Perfect for date night."
"REALLY REALLY BAD SERVICE! I WAS WAITING WITH MY FAMILY 1 and 1/2 HOUR FOR A TABLE.  THE GIRL AT THE DOOR WAS VERY BUSY ON HER PHONE TO LOOK FOR ONE AND THE WORST IS THAT THE RESTAURANT WAS ALMOST EMPTY.  MY CHILDREN, MY MOTHER-IN-LAW, MY HUSBAND AND I LEFT WITH HUNGER THANKS TO THIS GIRL."
"Wonderful experience all around. Food and service excellent! Love what they’ve done with the place too, beautiful new interior."
"Reasonably priced Thai food. They have a good variety of items and do the classics very well. It's americanized Thai, so expect dishes to be more sweet, less spicy. Portions are super generous and prices are fair. Staff is friendly and the ambiance is festive."
Amazing place.Great service. Food is delicious.
"Diner looking place, the only thing that gives you an impression of Thailand is the random table in the middle of the restaurant where waitresses keep plates and utensils. After coming back from Thailand nothing in NJ comes close to the authentic Thai food. Pad Thai here which is marked ""best seller in NJ"" was sub par compare to Pho Thai-Lao Kitchen in Maywood, NJ (still the best pad thai for my taste buds)."
